[
  {
    "id": "q_hsa_01",
    "type": "single_choice",
    "subject": "Mathematics",
    "exam_type": "HSA",
    "grade": "Toán 12",
    "topic": "Đại số",
    "subtopic": "Cấp số nhân",
    "skills": [
      "skill_calculation",
      "skill_reasoning"
    ],
    "difficulty": "Dễ",
    "difficulty_score": 0.35,
    "cognitive_level": "M2",
    "estimated_time_seconds": 60,
    "question": "Cho cấp số nhân \\((u_n)\\) có số hạng đầu \\(u_1 = 3\\) và công bội \\(q = 2\\). Giá trị của số hạng thứ 8 là:",
    "options": [
      "192",
      "384",
      "768",
      "256"
    ],
    "correct_answer": 1,
    "items": null,
    "correct_value": null,
    "explanation": "Số hạng tổng quát: \\(u_8 = u_1 \\cdot q^7 = 3 \\cdot 2^7 = 3 \\cdot 128 = 384\\).",
    "common_traps": [
      "Quên điều kiện cơ số khi giải bất phương trình logarit",
      "Chia cho biểu thức chưa xét khác 0"
    ],
    "prerequisites": [
      "kb_toan11_02"
    ],
    "year": 2025,
    "source_type": "official",
    "source": "Đề thi ĐGNL ĐHQGHN",
    "license": "CC BY-NC-SA 4.0",
    "tags": [
      "Cấp số nhân",
      "Dãy số",
      "HSA"
    ],
    "knowledge_id": "kb_toan11_02",
    "status": "published",
    "schema_version": "2.0"
  },
  {
    "id": "q_hsa_02",
    "type": "single_choice",
    "subject": "Mathematics",
    "exam_type": "HSA",
    "grade": "Toán 12",
    "topic": "Xác suất",
    "subtopic": "Biến cố đối",
    "skills": [
      "skill_probability",
      "skill_reasoning",
      "skill_data_analysis"
    ],
    "difficulty": "Dễ",
    "difficulty_score": 0.35,
    "cognitive_level": "M2",
    "estimated_time_seconds": 60,
    "question": "Một hộp chứa 6 quả cầu đỏ và 4 quả cầu xanh. Lấy ngẫu nhiên đồng thời 3 quả cầu. Xác suất để lấy được ít nhất 1 quả cầu đỏ là:",
    "options": [
      "\\(\\frac{29}{30}\\)",
      "\\(\\frac{1}{30}\\)",
      "\\(\\frac{5}{6}\\)",
      "\\(\\frac{4}{5}\\)"
    ],
    "correct_answer": 0,
    "items": null,
    "correct_value": null,
    "explanation": "Xác suất biến cố đối (cả 3 quả đều xanh): \\(P(\\bar{A}) = \\frac{C_4^3}{C_{10}^3} = \\frac{4}{120} = \\frac{1}{30}\\). Do đó xác suất cần tìm là \\(1 - 1/30 = 29/30\\).",
    "common_traps": [
      "Nhầm giữa biến cố độc lập và biến cố xung khắc",
      "Không áp dụng đúng công thức Bayes",
      "Đếm lặp trường hợp khi áp dụng quy tắc cộng"
    ],
    "prerequisites": [
      "kb_toan10_05"
    ],
    "year": 2025,
    "source_type": "official",
    "source": "Đề thi ĐGNL ĐHQGHN",
    "license": "CC BY-NC-SA 4.0",
    "tags": [
      "Xác suất",
      "Tổ hợp",
      "Biến cố đối"
    ],
    "knowledge_id": "kb_toan10_05",
    "status": "published",
    "schema_version": "2.0"
  },
  {
    "id": "q_hsa_03",
    "type": "single_choice",
    "subject": "Mathematics",
    "exam_type": "HSA",
    "grade": "Toán 12",
    "topic": "Đại số",
    "subtopic": "Phương trình Logarit",
    "skills": [
      "skill_calculation",
      "skill_reasoning"
    ],
    "difficulty": "Dễ",
    "difficulty_score": 0.35,
    "cognitive_level": "M2",
    "estimated_time_seconds": 60,
    "question": "Nghiệm của phương trình \\(\\log_2(x - 1) + \\log_2(x + 1) = 3\\) là:",
    "options": [
      "\\(x = \\pm 3\\)",
      "\\(x = 3\\)",
      "\\(x = \\sqrt{10}\\)",
      "\\(x = 4\\)"
    ],
    "correct_answer": 1,
    "items": null,
    "correct_value": null,
    "explanation": "Điều kiện \\(x > 1\\). Phương trình trở thành \\(x^2 - 1 = 8 \\iff x^2 = 9 \\implies x = 3\\).",
    "common_traps": [
      "Quên điều kiện cơ số khi giải bất phương trình logarit",
      "Chia cho biểu thức chưa xét khác 0"
    ],
    "prerequisites": [
      "kb_toan12_02"
    ],
    "year": 2024,
    "source_type": "official",
    "source": "Đề thi ĐGNL ĐHQGHN",
    "license": "CC BY-NC-SA 4.0",
    "tags": [
      "Logarit",
      "Điều kiện nghiệm"
    ],
    "knowledge_id": "kb_toan12_02",
    "status": "published",
    "schema_version": "2.0"
  },
  {
    "id": "q_hsa_04",
    "type": "single_choice",
    "subject": "Mathematics",
    "exam_type": "HSA",
    "grade": "Toán 12",
    "topic": "Hình học",
    "subtopic": "Thể tích khối chóp",
    "skills": [
      "skill_spatial",
      "skill_reasoning"
    ],
    "difficulty": "Trung bình",
    "difficulty_score": 0.65,
    "cognitive_level": "M3",
    "estimated_time_seconds": 90,
    "question": "Cho hình chóp \\(S.ABC\\) có đáy \\(ABC\\) là tam giác vuông cân tại \\(B\\), cạnh \\(AB = a\\). Cạnh bên \\(SA\\) vuông góc với mặt phẳng đáy và \\(SA = a\\sqrt{2}\\). Thể tích của khối chóp \\(S.ABC\\) bằng:",
    "options": [
      "\\(\\frac{a^3\\sqrt{2}}{6}\\)",
      "\\(\\frac{a^3\\sqrt{2}}{2}\\)",
      "\\(\\frac{a^3\\sqrt{2}}{3}\\)",
      "\\(\\frac{a^3}{6}\\)"
    ],
    "correct_answer": 0,
    "items": null,
    "correct_value": null,
    "explanation": "Thể tích: \\(V = \\frac{1}{3} S_{ABC} \\cdot SA = \\frac{1}{3} \\cdot \\frac{a^2}{2} \\cdot a\\sqrt{2} = \\frac{a^3\\sqrt{2}}{6}\\).",
    "common_traps": [
      "Nhầm góc giữa đường thẳng và mặt phẳng với góc giữa đường thẳng và VTPT",
      "Sai dấu khi tính tích có hướng trong không gian Oxyz"
    ],
    "prerequisites": [
      "kb_toan12_04"
    ],
    "year": 2025,
    "source_type": "official",
    "source": "Đề thi ĐGNL ĐHQGHN",
    "license": "CC BY-NC-SA 4.0",
    "tags": [
      "Hình chóp",
      "Thể tích",
      "Không gian"
    ],
    "knowledge_id": "kb_toan12_04",
    "status": "published",
    "schema_version": "2.0"
  },
  {
    "id": "q_hsa_05",
    "type": "single_choice",
    "subject": "Mathematics",
    "exam_type": "HSA",
    "grade": "Toán 12",
    "topic": "Đại số",
    "subtopic": "Cấp số cộng",
    "skills": [
      "skill_calculation",
      "skill_reasoning"
    ],
    "difficulty": "Dễ",
    "difficulty_score": 0.35,
    "cognitive_level": "M2",
    "estimated_time_seconds": 60,
    "question": "Một cấp số cộng \\((u_n)\\) có số hạng đầu \\(u_1 = -2\\) và công sai \\(d = 5\\). Số hạng thứ 20 của cấp số cộng là:",
    "options": [
      "93",
      "98",
      "103",
      "88"
    ],
    "correct_answer": 0,
    "items": null,
    "correct_value": null,
    "explanation": "Công thức số hạng tổng quát: \\(u_n = u_1 + (n-1)d\\). Với \\(n = 20\\): \\(u_{20} = -2 + 19 \\cdot 5 = -2 + 95 = 93\\).",
    "common_traps": [
      "Quên điều kiện cơ số khi giải bất phương trình logarit",
      "Chia cho biểu thức chưa xét khác 0"
    ],
    "prerequisites": [
      "kb_toan11_02"
    ],
    "year": 2025,
    "source_type": "official",
    "source": "Đề thi ĐGNL ĐHQGHN",
    "license": "CC BY-NC-SA 4.0",
    "tags": [
      "Cấp số cộng",
      "Đại số"
    ],
    "knowledge_id": "kb_toan11_02",
    "status": "published",
    "schema_version": "2.0"
  },
  {
    "id": "q_hsa_06",
    "type": "single_choice",
    "subject": "Mathematics",
    "exam_type": "HSA",
    "grade": "Toán 12",
    "topic": "Đại số",
    "subtopic": "Cực trị lượng giác",
    "skills": [
      "skill_calculation",
      "skill_reasoning"
    ],
    "difficulty": "Dễ",
    "difficulty_score": 0.35,
    "cognitive_level": "M2",
    "estimated_time_seconds": 60,
    "question": "Giá trị lớn nhất của hàm số lượng giác \\(y = 2\\sin x + 3\\cos x\\) là:",
    "options": [
      "5",
      "\\(\\sqrt{13}\\)",
      "\\(\\sqrt{5}\\)",
      "13"
    ],
    "correct_answer": 1,
    "items": null,
    "correct_value": null,
    "explanation": "Theo bất đẳng thức Cauchy-Schwarz: \\((2\\sin x + 3\\cos x)^2 \\le (2^2 + 3^2)(\\sin^2 x + \\cos^2 x) = 13 \\cdot 1 = 13\\). Vậy giá trị lớn nhất là \\(\\sqrt{13}\\).",
    "common_traps": [
      "Quên điều kiện cơ số khi giải bất phương trình logarit",
      "Chia cho biểu thức chưa xét khác 0"
    ],
    "prerequisites": [
      "kb_toan11_01"
    ],
    "year": 2025,
    "source_type": "official",
    "source": "Đề thi ĐGNL ĐHQGHN",
    "license": "CC BY-NC-SA 4.0",
    "tags": [
      "Lượng giác",
      "Max Min"
    ],
    "knowledge_id": "kb_toan11_01",
    "status": "published",
    "schema_version": "2.0"
  },
  {
    "id": "q_hsa_07",
    "type": "single_choice",
    "subject": "Mathematics",
    "exam_type": "HSA",
    "grade": "Toán 12",
    "topic": "Đại số",
    "subtopic": "Toán tài chính & Lãi kép",
    "skills": [
      "skill_calculation",
      "skill_reasoning"
    ],
    "difficulty": "Dễ",
    "difficulty_score": 0.35,
    "cognitive_level": "M2",
    "estimated_time_seconds": 60,
    "question": "Bác An gửi tiết kiệm 100 triệu đồng vào ngân hàng với lãi suất kép 6%/năm. Hỏi sau 3 năm, số tiền cả gốc và lãi bác An nhận được là bao nhiêu (làm tròn đến triệu đồng)?",
    "options": [
      "118 triệu",
      "119 triệu",
      "120 triệu",
      "121 triệu"
    ],
    "correct_answer": 1,
    "items": null,
    "correct_value": null,
    "explanation": "Công thức lãi kép: \\(A = P(1 + r)^n = 100(1 + 0,06)^3 = 100(1,191016) \\approx 119,1\\) triệu đồng.",
    "common_traps": [
      "Quên điều kiện cơ số khi giải bất phương trình logarit",
      "Chia cho biểu thức chưa xét khác 0"
    ],
    "prerequisites": [
      "kb_toan11_02"
    ],
    "year": 2024,
    "source_type": "official",
    "source": "Đề thi ĐGNL ĐHQGHN",
    "license": "CC BY-NC-SA 4.0",
    "tags": [
      "Lãi kép",
      "Toán tài chính"
    ],
    "knowledge_id": "kb_toan11_02",
    "status": "published",
    "schema_version": "2.0"
  },
  {
    "id": "q_hsa_08",
    "type": "single_choice",
    "subject": "Mathematics",
    "exam_type": "HSA",
    "grade": "Toán 12",
    "topic": "Đại số",
    "subtopic": "Phương trình lượng giác",
    "skills": [
      "skill_calculation",
      "skill_reasoning"
    ],
    "difficulty": "Trung bình",
    "difficulty_score": 0.65,
    "cognitive_level": "M3",
    "estimated_time_seconds": 90,
    "question": "Số nghiệm của phương trình lượng giác \\(\\cos 2x - 3\\cos x + 2 = 0\\) trên đoạn \\([0, 2\\pi]\\) là:",
    "options": [
      "2",
      "3",
      "4",
      "1"
    ],
    "correct_answer": 2,